Reference #,Title,Agency,Contract Value
MRWA0036200020,Provision of Asphalt Widening M037 Collie - Lake King Road SLK 181-195 & 300-327 - Wheatbelt Region,Main Roads Western Australia,"$ 4,010,670.00 "
PRODOC25063,MWG Refurbishment 25B Clematis Street Karloo,Programmed Facility Management,"$ 118,420.00 "
SRT2025023,"Supply, Delivery and Installation of Two (2) Wall Mounted Jib Cranes for South Regional TAFE",South Regional TAFE,"$ 33,455.00 "
SRT2025022,"Supply and Delivery of one (1) Skid Steer Loader, for South Regional TAFE, Collie Campus Workshop",South Regional TAFE,"$ 99,000.00 "
F2500245,Collection and Disposal of Sea Containers,VenuesWest,$ 200.00 
WAPOL00825,Asset Investigation Services,Western Australia Police Force,"$ 550,000.00 "
DBCA760GT2312024,Work Health and Safety IT System,"Department of Biodiversity, Conservation and Attractions","$ 2,104,309.00 "
ED252360,Electricity - Rockingham Beach Primary School (CUAELC2012),Department of Education,"$ 94,761.00 "
ED251921,Student travel to Canberra For Ocean Reef Senior High School,Department of Education,"$ 125,750.00 "
DHW25015,Provision of  Desktop Officer to support  Stage 2 Reform Works under CUATPS2024,Department of Housing and Works,"$ 65,000.00 "
DHW202541533,Design and Construct 3 x (2 Bed x 1 Bath) and 1 x (5 bed x 2 bath) Grouped Residential Dwellings at Lot 66 (12) Ashley Avenue Kewdale 6105,Department of Housing and Works,"$ 1,545,266.00 "
DHW0535324,Department of Primary Industries and Regional Development - Kununurra Quarantine Yard - Replacement of Livestock Crush,Department of Housing and Works,"$ 114,447.00 "
DHW0412925,Child and Adolesence Health - Perth Childrens Hospital - ACP Replacement,Department of Housing and Works,"$ 159,834.00 "
DHW0397425,Department of Education - Harvey Primary School - 2025 - 2026 Toilets Refresh Program,Department of Housing and Works,"$ 126,552.00 "
DHW0380225,Department fo Education - Yanchep Secondary College - Installation of 4x GLA Modular Classrooms with Associated Deck and Ramps,Department of Housing and Works,"$ 297,850.00 "
DPLH100224,Tree Lopping Panel - Perth Metropolitan,"Department of Planning, Lands and Heritage","$ 2,850,000.00 "
DPIRD2025226,Business Case for Increased Investment in Primary Industries and Development (PID) 2026/27 and Beyond,Department of Primary Industries and Regional Development,"$ 81,615.00 "
DOT411225,Cleaning Marine Operation Centre - Fremantle,Department of Transport and Major Infrastructure,"$ 267,734.00 "
MRWA0349240243,Provision of Temporary Personnel - OMTID - Business Services - Project Support Officer,Main Roads Western Australia,"$ 64,990.00 "
MRWA020122B,Panel Contract for the Provision of Metropolitan Vegetation Maintenance Services,Main Roads Western Australia,$ 1.00 
NRTAFE122024,Supply and Delivery of Post Hoist Set (x6) - Heavy Vehicle Lifts,North Regional TAFE,"$ 105,050.00 "
PROMSA25143,Court Rebuild and Shade Structure - Armadale SHS,Programmed Facility Management,"$ 819,800.00 "
PRODOC25095,PW10595 SM Refurbishment Unit 1 2 Chalmers Street Fremantle,Programmed Facility Management,"$ 154,600.00 "
PRODOC25093,"Refurbishment 11 Hargreaves Road, Coolbellup",Programmed Facility Management,"$ 235,250.00 "
PRODOC25089,SM Refurbishment U1 17 Esprit Parkway Greenfields,Programmed Facility Management,"$ 167,950.00 "
PTA251100,North Fremantle Integrated Transport Design Study,Public Transport Authority,"$ 221,429.00 "
PTA250859,Construction & Fit Out of the Extension for the Transwa Office,Public Transport Authority,"$ 198,483.00 "
SMT2025276,Cisco Wireless Access Points and Cisco Wireless Lecense Essentials,South Metropolitan TAFE,"$ 233,155.00 "
P26084A,Perth Motorplex Geotecnical Investigation,VenuesWest,"$ 68,765.00 "
P25032,WA Rugy Centre Community Hub Stage 1 Players’ Lounge,VenuesWest,"$ 56,462.00 "
WACHS202515236,Albany Health Campus (AHC) Kitchen Vinyl Replacement,WA Country Health Service,"$ 225,000.00 "
WACHS202312739,"Service/Maintenance and Upgrades for Building Management Systems, CCTV and Access Control  - Pilbara",WA Country Health Service,"$ 4,750,000.00 "
WACHS202312612,"Service/Maintenance and Upgrades for BMS, CCTV and Access Control across the Kimberley Region",WA Country Health Service,"$ 3,476,298.00 "
CRTF250000803,"Supply, Delivery & Installation of Commercial Electric Cooking Equipment with Pressure Cooking & Advanced Control Systems",Central Regional TAFE,"$ 62,901.00 "
DHW0742402522,Department of Justice - Roebourne Regional Prison -  Housing Unit RCD Upgrade,Department of Housing and Works,"$ 50,688.00 "
DHW0295425,Department of Justice - Kalgoorlie Courthouse - Fire Indicator Panels and Electrical Wiring Intercommunication System Replacement,Department of Housing and Works,"$ 139,997.00 "
DHW0228925,Department of the Premier and Cabinet - Parliamentary Electorate Office Girrawheen -  Fit Out,Department of Housing and Works,"$ 190,773.00 "
DOJ202523229,Employee Vaccination Program,Department of Justice,"$ 206,379.00 "
DPLH101724,MapTaskr Licensing and Support,"Department of Planning, Lands and Heritage","$ 262,802.00 "
DPIRD2025229,Supply & Delivery of One (1) Near Infrared Spectroscopy (NIR) XDS,Department of Primary Industries and Regional Development,"$ 155,771.00 "
TWDC05512025,ICT Project Management services (via CUAICT2021),Department of Training and Workforce Development (DTWD),"$ 4,417,201.00 "
DOT404017c343,Request for Tender for Project Management Services for Two Rocks Marina Wharf Replacement,Department of Transport and Major Infrastructure,"$ 668,928.00 "
TREAS26003,Independent ARC Chair,Department of Treasury and Finance,"$ 181,500.00 "
EMHS202514801,Supply of one Stereotactic Image-Guided Surgical Navigation System with post warranty service and maintenance for Spinal Surgery at Royal Perth Hospital,East Metropolitan Health Service,"$ 995,310.00 "
LG02412025,HPE Tech Care Essential Support Service,Landgate,"$ 163,704.00 "
LG02292025,Commvault Backup & Recovery for Virtual Machines,Landgate,"$ 109,560.00 "
MRWA003425,Provision of Mental Health First Aid Training,Main Roads Western Australia,"$ 124,520.00 "
NMTAFEC2025001,Provision of Cafeteria Services (Lease Agreement),North Metropolitan TAFE,$ 1.00 
PRODOC25067,MWG Internal and External Paint DOHW Nominated Sites Exmouth,Programmed Facility Management,"$ 221,978.00 "
P26086A,Perth Motorplex Dragstrip Track Replacement,VenuesWest,"$ 5,199,152.00 "
P26082A,Perth High Performance Centre - Electrical Infrastructure Upgrades,VenuesWest,"$ 446,875.00 "
WCQ0253,Public Website - Operational support services contract,Workcover Western Australia,"$ 152,856.00 "
CUAELC20212071025ACT,Electricity Services 2025,Arts and Culture Trust,"$ 1,166,994.00 "
DHW2025000836,Yungngora Aboriginal Community – Wastewater Treatment Pond Rectification and Associated Works - Civil Consultancy Services,Department of Communities,"$ 107,883.00 "
DHW2025000835,Yungngora Aboriginal Community – Contract Administration Services (including a Superintendent’s Representative role) during the Design and Construction Phases for the Works Contract,Department of Communities,"$ 144,152.00 "
ED252147,Canberra and Sydney Tour for Shenton College,Department of Education,"$ 228,400.00 "
DFESPOREQ0007116,Project Coordinator,Department of Fire and Emergency Services,"$ 88,000.00 "
DHW0462925,Department of Education - Albany Local Education Office -  Ceiling Replacement,Department of Housing and Works,"$ 141,175.00 "
DHW0440925,Department of Education - Exmouth District High School - New Welding Exhaust,Department of Housing and Works,"$ 70,053.00 "
DHW0435325,Department of Education - College Row School - Room 6 Ceiling Replacement.,Department of Housing and Works,"$ 53,848.00 "
DHW0283525,Department of Education - Maddington Primary School - Installation of 1x KPP Modular Classroom with Associated Patio,Department of Housing and Works,"$ 175,928.00 "
LGIRS25454,Key Operations Establishment and Support,"Department of Mines, Petroleum and Exploration","$ 249,755.00 "
DPLH406325,Engagement of ICT Document Writer,"Department of Planning, Lands and Heritage","$ 223,187.00 "
DPIRD2025259,Supply and Delivery of Hard Hose Irrigation System,Department of Primary Industries and Regional Development,"$ 139,287.00 "
DPIRD2025239,Provision of PCR Machine for the Broadacre Systems Team,Department of Primary Industries and Regional Development,"$ 81,040.00 "
LAWA20250731,Program Architecture Services - Digital Transformation Program,Legal Aid Commission of WA,"$ 818,250.00 "
MRWA0349240245,Provision of Temporary Personnel - RMO - Electrical Asset Management - Project Management Support,Main Roads Western Australia,"$ 109,625.00 "
MRWA0349240242,Provision of Temporary Personnel - Electrical Asset Management - Project Manager Support,Main Roads Western Australia,"$ 105,658.00 "
MRWA0349240231,Provision of Temporary Personnel - RMO - Electrical Asset Management - Electrical Asset Administration Support,Main Roads Western Australia,"$ 57,164.00 "
MRWA005725,Provision and Supply of Surveillance Services for Great Southern Region Seal and Reseal,Main Roads Western Australia,"$ 190,850.00 "
MRWA0044210017,Pavement Repairs 2025-26 - Various Roads - Goldfields-Esperance Region,Main Roads Western Australia,"$ 12,114,190.00 "
MHC2025088,Contract Management Audit 2025,Mental Health Commission,"$ 27,720.00 "
NMTAFEP2025003,Provision of Virtual Reality Development and Production Services for the WA Career Taster Program,North Metropolitan TAFE,"$ 1,300,000.00 "
PROMSA25164,Accessible Toilet and Laundry Upgrade,Programmed Facility Management,"$ 209,585.00 "
PROMSA25152,Block 8 Roof Replacement Stages 01 & 02 - SM TAFE Thornlie Campus,Programmed Facility Management,"$ 311,010.00 "
PROMSA25148,Drama Centre Upgrade - John Curtin College of the Arts,Programmed Facility Management,"$ 146,926.00 "
PROMSA25144,Metal Strip Ceiling Program - Yule Brook College,Programmed Facility Management,"$ 271,524.00 "
PRODOC25085,PW10595 MWG Refurbishment - 11B Salmon Loop Exmouth GROH,Programmed Facility Management,"$ 254,500.00 "
PTA251002,Feasibility Design - Perth Stadium Station Access Upgrade,Public Transport Authority,"$ 195,067.00 "
PTA250853,Level 2 Detailed Visual Inspection and Engineering Assessment,Public Transport Authority,"$ 184,824.00 "
DBCARIAQ6825,Whadjuk Noongar Heritage Monitoring Services,Rottnest Island Authority,"$ 720,000.00 "
DFES246825,Market Research Services for Bushfire and Cyclone Safety Awareness Campaigns,Department of Fire and Emergency Services,"$ 64,350.00 "
DHW0408125,Department of Education - Morley Senior High School - Toilet Refresh Program,Department of Housing and Works,"$ 131,474.00 "
DHW0384125,Department of Education - North Perth Primary School - Relocation of 1 x GLA Transportable Classroom including associated works,Department of Housing and Works,"$ 87,252.00 "
DPLH401725,Soil Validation and Monitoring at Former Gnowangerup Agricultural College,"Department of Planning, Lands and Heritage","$ 168,642.00 "
DPIRD2025220,"Supply, Delivery, Installation and System Training of One (1) MiSeq i100 Series High Throughput Sequencer",Department of Primary Industries and Regional Development,"$ 186,057.00 "
DOT417525,Principal Environmental Officer – Marine Projects – Category C,Department of Transport and Major Infrastructure,"$ 399,488.00 "
DOT413625,Westport Material Sourcing Category Management,Department of Transport and Major Infrastructure,"$ 450,450.00 "
DOT409721c044,"Concept designs for an alternative to the Dundas Road Primary Route between Kalamunda Road and High Wycombe Station, and the Maida Vale Road Secondary Route",Department of Transport and Major Infrastructure,"$ 274,588.00 "
EMHS202515293,Royal Perth Hospital (RPH) R Block Level 5 Roof Membrane Replacement,East Metropolitan Health Service,"$ 407,552.00 "
EMHS202514432,Medical Transcription Services to Royal Perth Bentley Group,East Metropolitan Health Service,"$ 1,072,800.00 "
LW25199,Temporary Personnel Services - Workplace Services Officer,Lotterywest,"$ 73,028.00 "
MRWA0349240230,Provision of Temporary Personnel - RMO - Delivery Planning & Contracts - Contracts Administration Support,Main Roads Western Australia,"$ 58,461.00 "
NMHS202515121,Purchase and Supply of a Stereotactic Radiosurgery Quality Assurance (QA) Phantom,North Metropolitan Health Service,"$ 192,203.00 "
PROMSA25165,Wooroloo Prison Farm - Keywatcher Upgrade,Programmed Facility Management,"$ 152,849.00 "
PROMSA25163,Plasterglass Ceiling Remediation Program - Kapinara Primary School,Programmed Facility Management,"$ 247,747.00 "
F2400604,Beer and Cider for Nominated VenuesWest Venues,VenuesWest,"$ 750,000.00 "
WACHS202514836,Supply and Installation of a Paging System with Support and Maintenance at Broome Health Campus,WA Country Health Service,"$ 81,420.00 "
WAPOL12325,"Delivery of Case Management Model for Health, Welfare and Safety Division",Western Australia Police Force,"$ 44,000.00 "
HSS202515339,Services of an OutSystems Senior Developer (ASK),Health Support Services,"$ 198,616.00 "
RFQ14102025ACT,Project Management Consultant (Marketing),Arts and Culture Trust,"$ 82,500.00 "
DOC202436542,Allied Health and Paediatric Service Expansion for South Metropolitan and Peel Region,Department of Communities,"$ 1,500,000.00 "
DLGSCC2538,Electricity Supply for Perth Concert Hall,"Department of Creative Industries, Tourism and Sport","$ 100,000.00 "
DoH202515285,Consultancy services to develop a Financial Cost Model for a shift-based (dispatch) operating model for non-emergency patient transport,Department of Health (Royal Street),"$ 132,000.00 "
DHW0472025,Department of Education - Armadale Education Support Centre - Installation of 1 x GLA Modular Classroom with Associated Deck and Ramp,Department of Housing and Works,"$ 113,751.00 "
DHW0439725,Department of Education - WA College Cunderdin - Painting Works,Department of Housing and Works,"$ 48,250.00 "
DHW0384725,Department of Education - Tuart Hill Primary School - Relocation of 1 x GLA Transportable Classrooms including associated works,Department of Housing and Works,"$ 90,450.00 "
DPIRD2025269,Senior Database Administrator - Temporary Personnel,Department of Primary Industries and Regional Development,"$ 125,054.00 "
EMHS202515488,Mount Lawley Hospital Commissioning & Transition – Program Build Support,East Metropolitan Health Service,"$ 185,955.00 "
EMHS202515011,Consultancy Services - AHS HV Electrical upgrades,East Metropolitan Health Service,"$ 444,952.00 "
MRWA010925,Supply of Workbench Renewal - Kimberley Region,Main Roads Western Australia,"$ 50,424.00 "
RWT00825,Provision of Cleaning Services,Racing and Wagering Western Australia,"$ 1,083,537.00 "
DBCARIAQ2726,Stakeholder Engagement Services,Rottnest Island Authority,"$ 136,730.00 "
20251701WAM,Reconstructing the demographic history of Black Cockatoos in southwest Western Australia using whole genome sequencing,Western Australian Museum,"$ 191,510.00 "
ED252534,Electricity - Gooseberry Hill Primary School (CUAELC2012),Department of Education,"$ 77,632.00 "
DFES243925,Supply and Delivery of a 15 Inch Woodchipper,Department of Fire and Emergency Services,"$ 167,283.00 "
DFES239025,Provision of Preferred Mental Health Providers,Department of Fire and Emergency Services,"$ 2,500,000.00 "
DoH2025CREST,Curtin Consumer-led Research Education and Support Training (CREST) Program Enhancement and Transition,Department of Health (Royal Street),"$ 149,781.00 "
DHW0743201422,Department of Education - Ngalapita Remote Community School Laundry,Department of Housing and Works,"$ 519,667.00 "
DHW0436425A,Department of Education - WA College Cunderdin - Dormitory Flooring Replacement,Department of Housing and Works,"$ 49,341.00 "
DHW0404925,Department of Education - Kent Street High School - Installation of 4x GLA Modular Classrooms with Associated Deck and Staircase,Department of Housing and Works,"$ 261,369.00 "
DHW0383625,Department of Education - Honeywood Primary School - Relocation of 1 x GLA Transportable Classrooms Including Associated Works,Department of Housing and Works,"$ 116,605.00 "
DPLH203025,"Groundwater Monitoring of Lot 810 Hepburn Avenue, Ballajura","Department of Planning, Lands and Heritage","$ 99,014.00 "
DPIRD2025101,Weaber Plain-Goomig groundwater modelling project,Department of Primary Industries and Regional Development,"$ 300,000.00 "
PROPTA25034,Malaga Bus Depot - CCTV Upgrade,Programmed Facility Management,"$ 129,581.00 "
PROMSA25126,Site Electrical Upgrade - Walliston Primary School,Programmed Facility Management,"$ 179,295.00 "
PTA251012,Fibre Optic Works - Radio Systems Replacement,Public Transport Authority,"$ 119,452.00 "
CAHS202515377,Specialised Solution Architecture Services,Child and Adolescent Health Service,"$ 680,223.00 "
DBCA752GT0162025,"Manufacture, Supply and Delivery of 90x Various Capacity Slip-on Fire Units","Department of Biodiversity, Conservation and Attractions","$ 1,679,605.00 "
ED252169,Natural Reticulated Gas Supply for Byford Secondary College (CUARGS2014),Department of Education,"$ 60,000.00 "
DWER202541735,Design and Construct 3 x (2 Bed x 1 Bath) Group Residential Dwellings at Lot 155 (4) Matterhorn Road Baldivis WA 6171,Department of Housing and Works,"$ 955,770.00 "
DHW9627225,"Design of 3 grouped dwellings at Lot 194 (7) Banks Street, Lockyer compromising of 3 x (2 bed x 1 bath) to Silver LHA Standard",Department of Housing and Works,"$ 21,750.00 "
DHW202541495,Design and Construct 10 x (2 Bed x 1 Bath) Grouped Residential Dwellings at Lot 10 (83) Gibson Way Beechboro WA 6063,Department of Housing and Works,"$ 3,681,224.00 "
DHW202541478,Design and Construct 3 x (2 Bed x 1 Bath) Grouped Residential Dwellings at Lot 468 (67) Vaughan Crescent Forrestdale WA 6112,Department of Housing and Works,"$ 1,127,902.00 "
DHW202541477,Design and Construct 3 x (2 Bed x 1 Bath) Grouped Residential Dwellings at Lot 154 (3) Trango Road Baldivis WA 6171,Department of Housing and Works,"$ 953,220.00 "
DHW0482325,Department of Primary Industries and Regional Development - State Biosecurity Response Centre - Superintendent Representative Consultant,Department of Housing and Works,"$ 303,704.00 "
DHW0372125,Department of Education - Karrinyup Primary School - Major Upgrade -Time Planning Services,Department of Housing and Works,"$ 62,617.00 "
DHW0319225,Department of Education - Wellard Village Primary School - Relocation of 2 x GLA Transportable Classroom and 1 x KPP Transportable Classroom including associated works,Department of Housing and Works,"$ 295,337.00 "
DHW0203525,Department of Education - Albany Senior High School - Biology Block Exterior Stone Wall Remediation - Areas 1 and 2 - Engineering Services,Department of Housing and Works,"$ 71,500.00 "
202540678,Construction of 4 - 1 Bed x 1 Bath Residential Dwellings at 33 Belgrade Road Wanneroo WA 6065,Department of Housing and Works,"$ 1,338,207.00 "
DPLH406225,Purchase of 50 notebook devices under CUACMD2021,"Department of Planning, Lands and Heritage","$ 102,388.00 "
DWER105725,Annual WasteSorted Awards Program,Department of Water and Environmental Regulation,"$ 127,101.00 "
MRWA0349240227,Provision of Temporary Personnel - RMO - Network Management - Asset Management Support,Main Roads Western Australia,"$ 92,524.00 "
MRWA0349240202,Provision of Temporary Personnel - Regional Management Operations - Plant Management Support,Main Roads Western Australia,"$ 61,806.00 "
MRWA009725,Procurement of a SenseHub Drone in a Box System,Main Roads Western Australia,"$ 133,960.00 "
MRWA001325,Provision of Smart Freeways Automatic Incident Detection Specialist Support Services,Main Roads Western Australia,"$ 173,853.00 "
PROPTA25032,D&C Internal Admin Upgrade - Malaga Bus Depot,Programmed Facility Management,"$ 404,383.00 "
PROPTA25030,Palmyra Lifting Service Bay,Programmed Facility Management,"$ 464,060.00 "
PROMSA25159,Electrical Upgrade - Ashfield Primary School,Programmed Facility Management,"$ 152,030.00 "
PTA250044,Supply and Maintentance of Mobile CCTV capabilities,Public Transport Authority,"$ 4,192,540.00 "
DBCA440CUA1022025,Supply and Delivery of MSA Flight Helmets under CUATAM2016,"Department of Biodiversity, Conservation and Attractions","$ 92,993.00 "
DOC202547018,Evaluation of the Choose Change Program,Department of Communities,"$ 159,225.00 "
DHW25021,Provision of Project and Change Manager under CUATPS2024,Department of Housing and Works,"$ 214,500.00 "
DHW202539367,"Design of 4 x (2 bed x 1 bath) Silver LHA & 3 x (2 bed x 1 bath) Gold LHS on Lot 12 (252) Middleton Road, Mira Mar",Department of Housing and Works,"$ 47,100.00 "
DHW0116124,Department of Primary Industries and Regional Development - DPIRD Broome Tropical Aquaculture Park Upgrades,Department of Housing and Works,"$ 1,040,574.00 "
DHW0112425F,Department of Education - 2025 Specialist Building Program - Construction of Four Home Economics buildings,Department of Housing and Works,"$ 3,317,554.00 "
DTF25001,"Design, Develop and Deliver Commissioning Training Sessions",Department of Treasury and Finance,"$ 290,280.00 "
DWER200324,Construction of Prefabricated River Monitoring Station,Department of Water and Environmental Regulation,"$ 235,703.00 "
DWER105625,Provision of One (1) ThermoFisher Scientific Model 1405DF Tapered Element Oscillating Microbalance (TEOM)-Ambient Particle Monitor,Department of Water and Environmental Regulation,"$ 91,025.00 "
EMHS202514764,HabitHack Content Management System,East Metropolitan Health Service,"$ 146,806.00 "
PRODOC25076,"Refurbishment - 35 Fane Crescent, Carnarvon",Programmed Facility Management,"$ 271,649.00 "
TWA2425168,Supply and Delivery of Tourism and Hospitality Schools Career Promotion Program 2025-2026,Western Australian Tourism Commission,"$ 150,000.00 "
CITS2587,Legal Services – NRL WACA Negotiations,"Department of Creative Industries, Tourism and Sport","$ 80,000.00 "
DHW202540675,"Construction of Lot 282 (31) Setosa Pass, Kununurra",Department of Housing and Works,"$ 763,578.00 "
DHW202540644,"Construction of Lot 280 (27) Setosa Pass, Kununurra",Department of Housing and Works,"$ 923,354.00 "
DHW202540640,Design and Construct 1 x (4 Bed x 2 Bath) Dwelling on Lot 293 (36) Zamia Link Kununurra WA 6743,Department of Housing and Works,"$ 923,354.00 "
DHW202540573,"Construction of Lot 285 (37) Setosa Pass, Kununurra",Department of Housing and Works,"$ 923,354.00 "
DHW202540566,"Construction of Lot 287 (41) Setosa Pass, Kununurra",Department of Housing and Works,"$ 923,354.00 "
DHW0411925T,North Metropolitan Health Service - SCGH - Maintenance,Department of Housing and Works,"$ 71,817.00 "
DHW0386025,Department of Education - North Albany Senior High School - Additions and Alterations - Election Commitment 2025 - Time Planning Services,Department of Housing and Works,"$ 129,283.00 "
DHW0374625,Department of Housing and Works - Various client agencies at various sites - Provision of routine maintenance,Department of Housing and Works,"$ 121,887.00 "
DHW0332625,"Department of Education - Leeman PS, Mingenew PS and Northampton DHS - Solar Upgrade Works - SCETF",Department of Housing and Works,"$ 67,533.00 "
DOJ202543944,Provision of Bus Feeder Service for Wooroloo Prison Farm,Department of Justice,"$ 221,247.00 "
LGIRS25335,Diploma of Government Investigations,"Department of Local Government, Industry Regulation and Safety","$ 57,800.00 "
DPIRD2025260,Customer Resolution Officer - Enterprise Information Management,Department of Primary Industries and Regional Development,"$ 180,070.00 "
DPIRD2025196,WebEOC Emergency Management System,Department of Primary Industries and Regional Development,"$ 298,462.00 "
DPC2325,Provision of an Employee Assistance Program,Department of the Premier and Cabinet,"$ 600,000.00 "
TWDC05762025,Provision of Mobile Services under CUATEL2021,Department of Training and Workforce Development (DTWD),"$ 60,912.00 "
DOT412325,User testing platform,Department of Transport and Major Infrastructure,"$ 271,730.00 "
LG02372025,Skyhigh SSE Essential Subscription Licences,Landgate,"$ 69,942.00 "
MRWA011925,Construction of Kerbing at Gibb Pentecost,Main Roads Western Australia,"$ 121,932.00 "
PROMSA25157,Replace Asbestos Cable Pitts,Programmed Facility Management,"$ 87,517.00 "
PROMSA25149,Metal Strip Ceiling Remediation Program - Kardinya Primary School,Programmed Facility Management,"$ 719,510.00 "
PROMSA25122,Mechanical Services Upgrade - Embleton PS & White Gum Valley PS,Programmed Facility Management,"$ 2,403,271.00 "
PROMSA25113,Clarkson CHS - Student Toilet Refurbishments,Programmed Facility Management,"$ 146,813.00 "
PRODOC25086,SM Refurbishment 4 Mitford Grove Port Kennedy WA,Programmed Facility Management,"$ 201,285.00 "
P24033A,Perth High Performance Centre - THAC Pools Remediation Works,VenuesWest,"$ 396,018.00 "
SMHS202515444,PHC Redevelopment functional brief development,South Metropolitan Health Service,"$ 165,000.00 "
CAHS202514953,CAHS Managed Print Service under HSS202311580,Child and Adolescent Health Service,"$ 7,550,000.00 "
DHW2025000449,Power Service connections to Lots 28 and 86 in Third Street - Warakurna Aboriginal Community,Department of Communities,"$ 74,683.00 "
DHW2025000448,"Procure power service connections for lots 15,370,371 and 135 in-Warburton Aboriginal Community",Department of Communities,"$ 108,438.00 "
DoH202514671,Cleaning Services for State Health Operations Centre (SHOC),Department of Health (Royal Street),"$ 803,869.00 "
DHW0470125,Department of Justice - West Kimberly Regional Prison Derby - Unit 4 Wet Well Pump Upgrade,Department of Housing and Works,"$ 73,062.00 "
DHW0470025,Department of Justice - West Kimberly Regional Prison Derby - Unit 1 Wet Well Pump Upgrade,Department of Housing and Works,"$ 73,062.00 "
DHW0416025,Department of Communities - Child Protection and Family Support - DCP Bunbury Office - Lighting Replacements & Upgrades,Department of Housing and Works,"$ 39,445.00 "
