Reference #,Title,Agency,Contract Value
MRWA033724,Supply Personal Protective Equipment for the Metropolitan Region.,Main Roads Western Australia,"$ 198,000.00 "
NMTAFEP2025002,Provision of Video Production Services for the WA Career Taster Program,North Metropolitan TAFE,"$ 397,464.00 "
ODPPADM2025306,Review of current Mental Health and Wellbeing Program (and associated supporting initiatives) at the ODPP,Office of the Director of Public Prosecutions for WA,"$ 59,897.00 "
PRODOC25074,Refurbishment - 15 Stewart Street Exmouth,Programmed Facility Management,"$ 165,347.00 "
PTA250777,N&I Fleet Tyre Replacement and Maintenance,Public Transport Authority,"$ 97,750.00 "
WACHS202515129,Provision of Cleaning for WA Country Health Service Shark Bay Nursing Post,WA Country Health Service,"$ 121,706.00 "
WAPOL09425,Behaviour Change Deep Dive 2025 Exploratory Research,Western Australia Police Force,"$ 208,604.00 "
ED250017,Gardening Services for Karratha Public Schools,Department of Education,"$ 3,860,445.00 "
ED252182,Electricity for Bunbury Senior High School (CUAELC2012),Department of Education,"$ 291,493.00 "
ICWAIPP1595,Snyk CLI,Insurance Commission of Western Australia,"$ 55,404.00 "
DBCA414WQ0432025,Assembly and Installation of Two (2) Prefabricated Double Cubicle Toilets at Helena and Aurora Ranges,"Department of Biodiversity, Conservation and Attractions","$ 123,495.00 "
DOC9615825,"Construction of 7 x (2 Bed x 1 Bath) & 1 x (1 Bed x 1 Bath) Aged Person residential dwellings at Lots 31 (60) & 32 (62) Seymour Street, West Busselton WA 6280",Department of Housing and Works,"$ 5,243,198.00 "
DHW0739822015,DPIRD - Katanning Research Station - HVAC Replacement Upgrade,Department of Housing and Works,"$ 56,657.00 "
LGIRS25426,Heritage Aerial Survey WA ARRAY,"Department of Mines, Petroleum and Exploration","$ 201,461.00 "
DPIRD2025228,State Barrier Fence Floodway Replacement,Department of Primary Industries and Regional Development,"$ 90,981.00 "
DOT420125,Alliance Advisor to assist with the delivery of OMID Projects - Evan Hambleton,Department of Transport and Major Infrastructure,"$ 199,721.00 "
DWER106025,European House Borer Infestation Remediation - Mount Observation,Department of Water and Environmental Regulation,"$ 56,485.00 "
ICWA060825,Provision of Actuarial Services for the Insurance Commission of Western Australia,Insurance Commission of Western Australia,"$ 3,800,000.00 "
LW25148,VMWare Licence Renewal,Lotterywest,"$ 583,989.00 "
MRWA0040230012,Panel Contract for the Provision of Sprayed Bitumen Resealing - Goldfields-Esperance Region,Main Roads Western Australia,"$ 4,329,547.00 "
PROMSA25111,Nedlands Primary School - Access ramp to year 5 classroom block,Programmed Facility Management,"$ 96,102.00 "
PTA250906,Commercial Support Services - Radio Systems Replacement,Public Transport Authority,"$ 188,100.00 "
RFQWAEC25001,Remote Electronic Voting solution for Non-Parliamentary Elections,Western Australian Electoral Commission,"$ 56,650.00 "
CAHS202515219,Calibration and Maintenance Services for CAHS Audiology Equipment,Child and Adolescent Health Service,"$ 250,000.00 "
ED251386,Guidelines for Students with Suicidal Behaviour and Non-suicidal self-injury (CUAAFA2024),Department of Education,"$ 52,195.00 "
DEMIRS25167,Evaluation of the Western Australian Social Housing Energy Performance Initiative,Department of Energy and Economic Diversification,"$ 222,860.00 "
DHW0579824A,DPIRD – DPIRD Rat Island Jetty - Lead Consultant,Department of Housing and Works,"$ 93,049.00 "
DHW0384525,Department of Education - West Coast Secondary Education Support Centre - Installation of 1 GLA Transportable,Department of Housing and Works,"$ 92,801.00 "
DHW0297025,Department of Education - Bruce Rock District High School - Delivery & Installation of 1 x KPP Modular Classroom and 1 x Shed,Department of Housing and Works,"$ 263,568.00 "
DHW0203825,Western Australia Police Force - Joondalup Police Academy -  Block L Refurbishment,Department of Housing and Works,"$ 589,822.00 "
TWDQ05712025,Venue and Catering Services for the 2026 WA Training Awards Presentation Ceremony,Department of Training and Workforce Development (DTWD),"$ 100,000.00 "
TWDQ05392025,Evaluation of the Defence Industry Skills Centre of Excellence,Department of Training and Workforce Development (DTWD),"$ 217,909.00 "
ICWAIPP1650,Applications Manager,Insurance Commission of Western Australia,"$ 214,720.00 "
JN249604,LG01382023,Landgate,$ 880.00 
JN249470,LG01382023,Landgate,"$ 1,430.00 "
JN249231,LG01382023,Landgate,"$ 1,100.00 "
JN249110,LG01382023,Landgate,"$ 1,980.00 "
JN248084,LG01382023,Landgate,$ 880.00 
JN247382,LG01382023,Landgate,"$ 1,430.00 "
MRWA008325,Provision of Aboriginal Heritage Services - Bussell Highway to Vasse Newtown,Main Roads Western Australia,"$ 127,078.00 "
MRWA008024,Provision of Labour & Concrete Requirements for GRR Mt Barnett on Gibb River Road SLK300 - Kimberley Region,Main Roads Western Australia,"$ 406,698.00 "
NMHS202515445,Replacement of Packaged Air Conditioner Unit #3 on Roof of Mt Henry Dental Clinic,North Metropolitan Health Service,"$ 80,000.00 "
NMHS202515213,Retail Electricity Supply to North Metropolitan Health Service Sites under CUAELC2012,North Metropolitan Health Service,"$ 42,442,602.00 "
MW25035,SCGH - G Block Level 7 - Ward G72 Storeroom Conversion,North Metropolitan Health Service,"$ 35,611.00 "
PTA250970,Road Coach Body Repairs,Public Transport Authority,"$ 247,500.00 "
PTA250043,Process Manager 2025 - 2028,Public Transport Authority,"$ 500,179.00 "
SRT2025001,"Security Services for South Regional TAFE: Albany, Denmark and Mount Barker Campuses",South Regional TAFE,"$ 507,587.00 "
SSO100325,Subscription to Lexis+AI and Lexis+ and Lexis Argument Analyser,State Solicitor's Office,"$ 100,848.00 "
2023796WAM2025,Provision of Mila-wall systems,Western Australian Museum,"$ 140,407.00 "
ED251884,Student Travel to Canberra for Merredin College,Department of Education,"$ 148,500.00 "
DOH202515281,Immunisation funding program,Department of Health (Royal Street),"$ 271,709.00 "
DHW0207325A,Department of Education - WA College Of Agriculture Harvey - Horticulture Irrigation Upgrades,Department of Housing and Works,"$ 204,123.00 "
202596191,Construction of 1 - 5 Bed x 2 Bath Residential Dwelling at 8 Thomas Street Manjimup WA 6258,Department of Housing and Works,"$ 823,626.00 "
202540298,Construction of 2 - 3 Bed x 1 Bath Residential Dwellings for 18 Verrier Loop Byford WA 6122,Department of Housing and Works,"$ 862,995.00 "
202540297,Construction of 2 - 2 Bed X 1 Bath Residential Dwellings at 22 Corymbia Bouldevarde Byford WA 6122,Department of Housing and Works,"$ 745,289.00 "
DOJ202432974,Provision of Hazardous Chemical Management System,Department of Justice,"$ 172,860.00 "
DEMIRS24922,Provision of Cleaning Services at Mineral House,"Department of Mines, Petroleum and Exploration","$ 3,869,312.00 "
DTMI411521c036,Subordinate Document Development,Department of Transport and Major Infrastructure,"$ 53,372.00 "
DTMI411521c035,Interface Manager (temporary position),Department of Transport and Major Infrastructure,"$ 248,042.00 "
LAWA20250313,Cleaning Services for Broome,Legal Aid Commission of WA,"$ 275,000.00 "
PROMSA25127,Roof Replacement and Cooling for Schools - Newborough Primary School,Programmed Facility Management,"$ 2,242,833.00 "
PTA250806,Vertical Transport Stage 1 - Reference Design,Public Transport Authority,"$ 487,630.00 "
DBCARIAQ0726,Provision of Laboratory Services,Rottnest Island Authority,"$ 168,182.00 "
WAPOL13225,Supply and Delivery of Drums and Protective Cases,Western Australia Police Force,"$ 72,270.00 "
ED251384,Provision of co-sourced internal audit services for the review of Corruption Prevention Mechanisms (CUAAFA2024),Department of Education,"$ 59,962.00 "
ED250094,Bus for Hammond Park Secondary College,Department of Education,"$ 362,528.00 "
LG02282025,Terria Software Licensing & Support,Department of Housing and Works,"$ 2,400,000.00 "
DHW202539800,Works Request for Quote - SR - Lot 151 (3) Farne Close WARWICK,Department of Housing and Works,"$ 92,000.00 "
DHW0742801622,Department of Communities - Roebourne DCP - Crimesafe Screens and Doors.,Department of Housing and Works,"$ 65,337.00 "
DHW0407125,Department of Education - Manning Primary School - Installation of x1 GLA Modular Classroom,Department of Housing and Works,"$ 92,339.00 "
DHW0297125,Department of Education -  Spencer Park Education Support Centre - Installation of 1 x GLA Kitchenette Transportable with Patio,Department of Housing and Works,"$ 258,190.00 "
DHW0296625,Department of Education - Jurien Bay District High School - Delivery Installation of 1 x GLA Modular,Department of Housing and Works,"$ 112,160.00 "
DHW0296425,Department of Education - Margaret River Senior High School - Installation 1 GLA (Art Room),Department of Housing and Works,"$ 112,909.00 "
DPLH401025,Aboriginal Heritage Survey of Kowtah Rock Hole and mining tenements P 39/6210 and P 39/6477,"Department of Planning, Lands and Heritage","$ 86,092.00 "
DOT690125,AIS - Great Southern - Albany Region,Department of Transport and Major Infrastructure,"$ 973,043.00 "
EMHS202514860,"Supply, Deliver, Install, Commission, Train, and Optional Post Warranty Service Agreement for One (1) Surgical Laser for Royal Perth Hospital Ear, Nose, and Throat Theatre Services",East Metropolitan Health Service,"$ 158,702.00 "
EMHS202412753,Non-Orthopaedic Surgical Robot for WA public Health Service Provider(s),East Metropolitan Health Service,"$ 22,500,000.00 "
MRWA011425,Provision of Aboriginal Heritage Services for Proposed Roadworks Within the Banjima Native Title Determination Area - Pilbara Region,Main Roads Western Australia,"$ 67,529.00 "
MRWA0040230014,Panel Contract for the Provision of Sprayed Bitumen Resealing - Midwest-Gascoyne Region,Main Roads Western Australia,"$ 16,867,500.00 "
NTPO4440,CGRE Grounds Maintenance,National Trust of Western Australia,"$ 60,000.00 "
MW24119WP3,Fire Panel Upgrades – Graylands Hospital (GH) and Sir Charles Gardiner Hospital (SCGH),North Metropolitan Health Service,"$ 389,653.00 "
PRODOC25087,PB Pest Control Various Properties Pilbara WA,Programmed Facility Management,"$ 110,050.00 "
PRODOC25069,MWG Refurbishment Two (2) DOHW Nominated Sites Wiluna WA,Programmed Facility Management,"$ 394,850.00 "
SMT2024074,Print Room Service,South Metropolitan TAFE,"$ 8,000,000.00 "
DBCABGPA10402025,Cleaning Services (Office Facilities in Kings Park and Bold Park),Botanic Gardens and Parks Authority,"$ 985,500.00 "
CITS2556,Telstra Mobile Telephony Services,"Department of Creative Industries, Tourism and Sport","$ 208,732.00 "
DHW0428925,Department of Health - GCP - Interim Multidisciplinary Engineering Services,Department of Housing and Works,"$ 80,000.00 "
DHW0427725,Provision of Routine Maintenance for Pest Services Bridging Services - Various Agencies - Various Sites - Kimberley Region,Department of Housing and Works,"$ 53,579.00 "
TWDQ05572025,Electrical Services at Muresk,Department of Training and Workforce Development (DTWD),"$ 99,000.00 "
DOT419425,Project Communications and Engagement Advisor - Carmel Luck,Department of Transport and Major Infrastructure,"$ 64,525.00 "
DOT414025,Purchase and Removal of Vessel (vessel registration: EH939),Department of Transport and Major Infrastructure,"$ 1,500.00 "
DWER305325,Temporary Personnel - Project Support Officer Water Science,Department of Water and Environmental Regulation,"$ 81,307.00 "
EMHS202515117,Critical Health ICT Infrastructure Program - Electrical Works (Works Package 3),East Metropolitan Health Service,"$ 63,133.00 "
MRWA003125,Provision of Aboriginal Heritage Services - Great Central Road (6070087/6120015) - Heritage Survey - Ngaanyatjarra Ethnographic Surveys,Main Roads Western Australia,"$ 617,141.00 "
CUARGS2014,Natural Reticulated Gas Supply,Metropolitan Cemeteries Board,"$ 592,500.00 "
MW25034,SCGH - G Block Level 7 - Rm 7.17.15 - Medication Room,North Metropolitan Health Service,"$ 66,870.00 "
PTA250966,Radio Frequency Identification Tags,Public Transport Authority,"$ 236,225.00 "
DBCARIAQ2626,"ICT Strategic, Technical and Project Management Services",Rottnest Island Authority,"$ 157,300.00 "
DBCA465ST2082024,Heavy machinery works for fire and conservation operations in the Wheatbelt Region.,"Department of Biodiversity, Conservation and Attractions","$ 2,000,000.00 "
DBCA243SQ0322025,Asset Management Review and Strategic Directions,"Department of Biodiversity, Conservation and Attractions","$ 69,706.00 "
ED252007,Electricity for Floreat Park Primary School (CUAELC2012),Department of Education,"$ 107,557.00 "
DFES247325,Review of Success Fire Station Health Monitoring Program,Department of Fire and Emergency Services,"$ 92,070.00 "
DFES229724,Monitoring Solution for ICT Services,Department of Fire and Emergency Services,"$ 603,950.00 "
MP0509624,Department of Health - The New Women and Babies Hospital Project - State Advisory Services - Multidisciplinary Engineering,Department of Housing and Works,"$ 9,886,503.00 "
FINW0769323,East Metropolitan Health Services - Byford Health Hub - Community-Based Health Care Facility,Department of Housing and Works,"$ 25,710,218.00 "
DHW0430025,Department of Education - Riverton Primary School - New K/PP Block - SIP - EC25 - Architectural Services,Department of Housing and Works,"$ 255,672.00 "
DHW0376225,Department of Education - Bridgetown Primary School - ACM Eaves and Plaster Glass Ceiling Replacement - Heritage Build,Department of Housing and Works,"$ 192,104.00 "
DHW0215925,Department of Education - The Broome Special Educational Needs Behaviour and Engagement Centre,Department of Housing and Works,"$ 2,066,538.00 "
DHW0157825,Department of Education - Harrisdale Senior High School - Relocation of 2 x GLAs Transportable Classrooms including associated works,Department of Housing and Works,"$ 188,902.00 "
202540250,Construction of 2 - 2 Bed x 1 Bath Residential Dwellings at 22 Kettering Parkway Wellard WA 6173,Department of Housing and Works,"$ 719,937.00 "
202540221,Construction of 2 - 1 Bed x 1 Bath Residential Dwellings at 13 Epping Way Wellard WA 6170,Department of Housing and Works,"$ 675,682.00 "
202540220,Construction of 2 - 1 Bed x 1 Bath Residential Dwellings at 9 Eastleigh Way Wellard WA 6170,Department of Housing and Works,"$ 638,002.00 "
202540219,Construction of 3 - 1 Bed x 1 Bath Residential Dwellings at 8 Kettering Parkway Wellard WA 6170,Department of Housing and Works,"$ 1,004,752.00 "
202540217,Construction of 2 - 2 Bed x 1 Bath Residential Dwellings at Lot 1994 (42) Brierfield Street Wellard WA 6170,Department of Housing and Works,"$ 715,081.00 "
202540006,Construction of 3 - 3 Bed x 1 Bath Residential Dwellings at 7 Appeal Street Ellenbrook WA 6069,Department of Housing and Works,"$ 1,166,436.00 "
202540005,Construction of 4 - 2 Bed x 1 Bath Residential Dwellings at 15 Ephemina Street Ellenbrook WA 6069,Department of Housing and Works,"$ 1,356,593.00 "
DEMIRS24901,Online Risk Management System,"Department of Local Government, Industry Regulation and Safety","$ 170,547.00 "
DPIRD2025253,Processing of Experimental Cattle from Kununurra Research Station,Department of Primary Industries and Regional Development,"$ 56,165.00 "
ICWAIPP1609,IT SOE Engineer,Insurance Commission of Western Australia,"$ 168,273.00 "
LAWA20250701,Information Architecture Services - Public Website,Legal Aid Commission of WA,"$ 794,310.00 "
LW25166,Services for a Static Security Guard in Lotterywest Foyer,Lotterywest,"$ 245,000.00 "
MRWA0349240160,Provision of Temporary Personnel - Delivery Planning Officer - Delivery Planning and Contracts,Main Roads Western Australia,"$ 76,193.00 "
MRWA0006200064,Provision of Consultancy Services for the Development of Dynamics to ArcGIS Enterprise Sync,Main Roads Western Australia,"$ 86,635.00 "
NMTAFEP2025021,Provision of Banana Test Leads,North Metropolitan TAFE,"$ 60,720.00 "
PROPTA25031,Southern River Workshop Insulation Upgrade,Programmed Facility Management,"$ 79,416.00 "
PROMSA25116,Supply and Install - Evaporative Units to Block 2,Programmed Facility Management,"$ 98,027.00 "
DBCARIAT0226,Geordie Bay Landscaping Works,Rottnest Island Authority,"$ 498,672.00 "
DBCARIAQ0526,Rottnest Island HEGS Bird and Bat Utilisation Assessment,Rottnest Island Authority,"$ 274,200.00 "
PF26002,VenuesWest Turf Farm Feasibility Study,VenuesWest,"$ 150,000.00 "
P26081A,Perth High Performance Centre Fire System Consultancy Services for Compliance Audit and Detailed Design,VenuesWest,"$ 75,416.00 "
P26061,Perth Motorplex Modular Toilet Replacement,VenuesWest,"$ 51,404.00 "
DOC202545027,Kimberley Floods Recovery – Healing on Country and Community Services,Department of Communities,"$ 248,950.00 "
ED250207,Printing Services for Graduate Teacher Induction Program,Department of Education,"$ 205,000.00 "
ED250199,Supply and Delivery of One (1) New Bus to Albany Residential College – 25 (approximately) Passenger Seats,Department of Education,"$ 215,955.00 "
FINW0450825,Department of Education - Broome Senior High School - Carpark Upgrade and Repairs,Department of Housing and Works,"$ 13,750.00 "
FINW0109325,Department of Education - Bunbury Senior High School - Erosion Rectification Works,Department of Housing and Works,"$ 872,762.00 "
DHW0374225,Department of Education - Harvey Primary School - Playground Equipment Replacement,Department of Housing and Works,"$ 279,994.00 "
DPLH204624,ABORIGINAL HERITAGE SURVEY AT CARNARVON MULLEWA ROAD (SPR-1031),"Department of Planning, Lands and Heritage","$ 44,436.00 "
DPLH201625,"Architectural Services for Conservation and Maintenance Works to No. 16 and 18 The Terrace, Fremantle Prison","Department of Planning, Lands and Heritage","$ 84,150.00 "
DOT413225,Information Architect Services,Department of Transport and Major Infrastructure,"$ 651,865.00 "
EMHS202514960,"Supply, Delivery, Installation, Commissioning and Post Warranty Service and Maintenance for One (1) Medical Equipment Washing and Decontamination System",East Metropolitan Health Service,"$ 156,172.00 "
ICWAIPP1563,Test Analyst,Insurance Commission of Western Australia,"$ 59,429.00 "
JN248758,LG01382023,Landgate,$ 1.00 
JN246565,LG01382023,Landgate,$ 1.00 
JN240016,LG01382023,Landgate,$ 1.00 
MRWA019624,Provision of Periodic Maintenance – Road Sweeping – Mid West-Gascoyne Region,Main Roads Western Australia,"$ 311,872.00 "
MRWA0098160268,"Urgent Repairs for Bridges 0845, 0846, 0849, 0976 and 1138",Main Roads Western Australia,"$ 170,932.00 "
MRWA0098160256,Bridge Replacement Works to Bridges 0255 & 0520A - South West Region,Main Roads Western Australia,"$ 3,602,384.00 "
MRWA007925,Supply of Bentley Enterprise Licensing Agreement Renewal,Main Roads Western Australia,"$ 311,791.00 "
PROMSA25097,Power Upgrade - Illawarra Primary School,Programmed Facility Management,"$ 259,826.00 "
DBCARIAT5425,Provision of Marketing and Creative Services,Rottnest Island Authority,"$ 480,000.00 "
SMT2025155,Aeroskills Trainer,South Metropolitan TAFE,"$ 68,188.00 "
SRT2025005,"Provision of Security Services for South Regional TAFE, Narrogin Campus",South Regional TAFE,"$ 108,380.00 "
SRT2025004,"Provision of Security Services for South Regional TAFE, Katanning Campus",South Regional TAFE,"$ 191,935.00 "
DOC202551285,Consultant to deliver an options paper on the future of its Supported Community Living Service,Department of Communities,"$ 87,400.00 "
ED252114,Electricity for Aveley Primary School (CUAELC2012),Department of Education,"$ 76,971.00 "
ED251937,Electricity for Fremantle College (CUAELC2012),Department of Education,"$ 466,143.00 "
ED250606,Supply and Delivery of one (1) new Fuso Rosa bus to Woodvale Secondary College - 25 Passenger Seats,Department of Education,"$ 207,975.00 "
DFESPOREQ0006965,Stores / Admin Support,Department of Fire and Emergency Services,"$ 68,814.00 "
DOH202515329,Queen Elizabeth Medical Centre II Additional Car Park Business Case Development,Department of Health (Royal Street),"$ 187,000.00 "
FINW0267622,Western Australian Police Force - New Facility - Kimberley District Support Facility,Department of Housing and Works,"$ 36,221,513.00 "
FINW0139523,"Department of Finance - Kununurra Government Building - Fit-out Alterations, external fencing and car park works.",Department of Housing and Works,"$ 6,845,892.00 "
DHW0432125A,Department of Education - Rostrata Primary School - New Primary School Block - SIP- EC25 - Cost Management Services,Department of Housing and Works,"$ 79,609.00 "
DHW0432025,Department of Education - Rostrata Primary School - New Primary School Block SIP EC25 - Architectural Services,Department of Housing and Works,"$ 255,672.00 "
DHW0280925,Western Australian Museum - WA Maritime Museum - Crane Removal,Department of Housing and Works,"$ 488,642.00 "
EMHS202413393,Interpreter Management System for East Metropolitan Health Service,East Metropolitan Health Service,"$ 565,666.00 "
GC2500093,Foundation slab,Gold Corporation,"$ 57,384.00 "
HSS202515297,Services of a Solution Architect,Health Support Services,"$ 217,250.00 "
MRWA0349240174,Provision of Temporary Personnel - OMTID - Business Services - Project Support Officer,Main Roads Western Australia,"$ 64,819.00 "
MRWA0349240173,Provision of Temporary Personnel - Major Projects - Cost Management Officer,Main Roads Western Australia,"$ 101,404.00 "
MRWA0349240162,Provision of Temporary Personnel - Business Support Officer - Metropolitan Region,Main Roads Western Australia,"$ 54,926.00 "
MRWA0165210024,Construction of the bus priorisation project at the intersection of Scarborough Beach Road and West Coast Highway,Main Roads Western Australia,"$ 2,645,522.00 "
ODPPADM2025339,Automated Transcription Services - Technical Specialist - CUAICTS2021,Office of the Director of Public Prosecutions for WA,"$ 49,500.00 "
PROMSA25069,BMS System Upgrade - Art Gallery of Western Australia,Programmed Facility Management,"$ 265,900.00 "
PRODOC25078,MWG Refurbishment 51 Foss Crescent Carnarvon,Programmed Facility Management,"$ 237,150.00 "
PTA251043,Civil & Structural project Engineer - HCS,Public Transport Authority,"$ 1,322,750.00 "
DBCARIAT8625,Ferry Passenger Commuter Service from Hillarys Marina,Rottnest Island Authority,"$ 990,000.00 "
VWFMAJ25001,Arena Joondalup - Sports Lighting Repairs,VenuesWest,"$ 90,460.00 "
WAPOL10425,Provision of Business Analyst Services - Firearms Reform Program,Western Australia Police Force,"$ 3,161,000.00 "
20251725WAM,Provision of a Replacement Work Vessel for the Maritime Heritage Department,Western Australian Museum,"$ 241,885.00 "
ED251907,Electricity for Tuart Rise Primary School (CUAELC2012),Department of Education,"$ 75,311.00 "
DFESPOREQ0006953,Test Analyst,Department of Fire and Emergency Services,"$ 127,295.00 "
DFES233724,Provision of Security and Monitoring Services for the Cockburn Emergency Services Complex and Other Nominated DFES Sites,Department of Fire and Emergency Services,"$ 2,500,000.00 "
FINW0590624,Department of Education - Newton Moore Senior High School - Air Conditioning Upgrade,Department of Housing and Works,"$ 621,664.00 "
DHW0742502822,Department of Fire and Emergency Services - Wickham VFRS - Station and Bathroom Remediation Works,Department of Housing and Works,"$ 53,025.00 "
DHW049425,Main Roads Department - 43 Songlark Loop Broome - Residential Shed Installation,Department of Housing and Works,"$ 29,731.00 "
DHW0429425,Main Roads WA - 43 Songlark Loop Broome - Installation of Residential Garden Shed,Department of Housing and Works,"$ 35,231.00 "
DHW0401125,Department of Education -  Primary and School Secondary School sites in the Perth Metropolitan Region -  Lead/Architectural Consultancy Services,Department of Housing and Works,"$ 1,533,950.00 "
DHW0399424,Department of Primary Industries and Regional Development - Kununurra Quarantine Services Stock Yards - Construction of Hay Shed,Department of Housing and Works,"$ 406,077.00 "
DHW0385925,Department of Education - North Albany Senior High School - Additions and Alterations - Election Commitment 2025 (EC25) - Cost Management Services,Department of Housing and Works,"$ 215,283.00 "
DHW0251925,Department of Education - Byford Primary School - New Kindergarten and Pre-Primary Block - Time Planning Services,Department of Housing and Works,"$ 10,989.00 "
DHW0086825,Main Roads of WA - Bunbury OFP Building - Eaves replacement and Internal/External Painting,Department of Housing and Works,"$ 224,279.00 "
LGIRS25375,Check Point Gateway Services Renewal 2025-26,"Department of Local Government, Industry Regulation and Safety","$ 197,935.00 "
LGIRS25319,Known Associates Australia Pty Ltd,"Department of Local Government, Industry Regulation and Safety","$ 82,648.00 "
DPC2419,WA Stolen Generation Redress Scheme - CRM Development Services,Department of the Premier and Cabinet,"$ 240,000.00 "
DOT410625,Power BI Reporting Development,Department of Transport and Major Infrastructure,"$ 71,379.00 "
DWER103125,Survey and Analysis of Litter in the Perth Metropolitan Area,Department of Water and Environmental Regulation,"$ 328,619.00 "
MRWA0349240177,Provision of Temporary Personnel - OMTID - Business Services - Project Support Officer,Main Roads Western Australia,"$ 64,819.00 "
PROMSA25117,Children's Garden Upgrade - Lake Monger PS,Programmed Facility Management,"$ 132,087.00 "
PROMSA250102,Design and Construct Senior Playground - Alkimos Primary School,Programmed Facility Management,"$ 139,920.00 "
M24001FFE,Arena Joondalup - Lap Pool Redevelopment - Aquatic FFE,VenuesWest,"$ 69,190.00 "
WACHS202514800,Provision of Automatic Doors to Karlarra House,WA Country Health Service,"$ 98,079.00 "
TWA2425195,Tourism Opportunity Analysis Abrolhos Islands,Western Australian Tourism Commission,"$ 82,885.00 "
DBCA411GT0572025,Culvert and Drainage Materials - Aluminium and Concrete,"Department of Biodiversity, Conservation and Attractions","$ 1,000,000.00 "
