Reference #,Title,Agency,Contract Value
PRODOC25103,PW10682 PB Refurbishment 11 Coolibah Way Wickham WA,Programmed Facility Management,"$ 157,185.00 "
SMHS202413924,Provision of a Workplace Injury Early Intervention Program (EIP) for South Metropolitan Health Service (SMHS),South Metropolitan Health Service,"$ 1,023,863.00 "
DWER200525,Bank Stability Works at Sandalwood - Brunswick River,Department of Water and Environmental Regulation,"$ 194,695.00 "
DWER105525,Water Monitoring Services,Department of Water and Environmental Regulation,"$ 840,000.00 "
PRODOC25102,"PB Refurbishment 19B Nelley Way, Wickham",Programmed Facility Management,"$ 189,892.00 "
DHW0475225,Department of Training & Work Place Development - Northern Regional TAFE Broome - Mains Electrical Supply Repairs,Department of Housing and Works,"$ 132,488.00 "
DHW0187802625,Department of Training and Workforce Development - Busselton TAFE Campus - Stormwater repairs,Department of Housing and Works,"$ 171,981.00 "
DWER106225,Environmental Protection Authority (EPA) Audiovisual (AV) Expansion,Department of Water and Environmental Regulation,"$ 206,769.00 "
DWER104925,Content Manager Licence Renewal and Support,Department of Water and Environmental Regulation,"$ 1,445,748.00 "
PROPTA25035,Redcliffe Wash Bay Upgrade,Programmed Facility Management,"$ 170,916.00 "
SMT2023097,Midrise Demonstration Educational Model,South Metropolitan TAFE,"$ 245,190.00 "
DFESPOREQ0007276,Procurement Officer,Department of Fire and Emergency Services,"$ 81,400.00 "
DHW0305425,Department of Education - Champion Bay Senior High School - Sports Hall - Election Commitment 2025 - Architectural Services,Department of Housing and Works,"$ 739,640.00 "
DHW0011726,Department of Education - One Arm Point Remote Community School - Fallen Trees Removal Tropical Cyclone Hayley,Department of Housing and Works,"$ 34,087.00 "
PRODOC25096,PW10611 PB Windows and Security Screens Karratha Pkg 6,Programmed Facility Management,"$ 109,340.00 "
WACHS202515324,"Provision of Consultancy Services for Kalbarri Health Campus Heating, Ventilation and Air Conditioning (HVAC) Mechanical Upgrade",WA Country Health Service,"$ 100,078.00 "
PRODOC25098,"Refurbishment - 17 Dowley Street, Cue",Programmed Facility Management,"$ 167,000.00 "
PTA250017,Provision of the Narrogin Regional Town Bus Services,Public Transport Authority,"$ 796,325.00 "
DHW0476125,"Department of Housing and Works - Provision of Routine Maintenance for Stormwater Management - Gutters, Downpipes and Stormwater Systems",Department of Housing and Works,"$ 711,034.00 "
WACHS202615363,GP Integrated Paediatric Development Clinic,WA Country Health Service,"$ 93,181.00 "
DHW0406725,Department of Education - Sheoak Grove Primary School - Installation of 2 x GLA Transportable Units,Department of Housing and Works,"$ 425,715.00 "
DPIRD2025267,Supply of Bulk Strawberries,Department of Primary Industries and Regional Development,"$ 90,000.00 "
MRWA0349240247,Provision of Temporary Personnel - Regional Management Operations - Electrical Asset Management - Data Analyst Support,Main Roads Western Australia,"$ 89,215.00 "
MCB20252613,Internal Road Construction Lawn Y,Metropolitan Cemeteries Board,"$ 131,120.00 "
WAPOL18624,VMware - Provision of virtualisation software with maintenance and support,Western Australia Police Force,"$ 7,190,000.00 "
DOC20249429,"Provision of a Concierge Service for the Department of Communities, Armadale District",Department of Communities,"$ 72,309.00 "
DHW0511525,Department of Justice - Broome Regional Prison - Removal of Asbestos Contaminated Material,Department of Housing and Works,"$ 29,260.00 "
DHW0338424,Provision of Routine Maintenance for Pest Control – Various Agencies – Various Sites – West Kimberley and East Kimberley,Department of Housing and Works,"$ 455,250.00 "
HSS202515531,The Provision of a Business Analyst Services for ASK project.,Health Support Services,"$ 147,620.00 "
HSS202515530,Provision of Lead Developer Resource for SF&R - Western Australia Virtue Emergency Department (WAVED),Health Support Services,"$ 104,676.00 "
LW2584,Content Manager Licence Maintenance,Lotterywest,"$ 283,225.00 "
MRWA006925,Supply and Delivery of Transportable Accommodation Units (Karratha) - Pilbara Region,Main Roads Western Australia,"$ 7,395,799.00 "
MRWA0006200074,Provision of Senior ITS Business Analyst Services,Main Roads Western Australia,"$ 229,900.00 "
MCB20252602,Grounds Maintenance for Rockingham Regional Memorial Park,Metropolitan Cemeteries Board,"$ 820,000.00 "
PROMSA25161,Resurface Basketball Courts - Floreat Park PS,Programmed Facility Management,"$ 375,095.00 "
PTA250019,Provision of Carnarvon Regional Town Bus Services,Public Transport Authority,"$ 6,243,379.00 "
SBDC112025,Data Centre Infrastructure Refresh,Small Business Development Corporation,"$ 232,676.00 "
20241704WAM,"Audio-Visual Services for Functions, Events and Programs",Western Australian Museum,"$ 1,000,000.00 "
TWA2607,International Employer of Record Services – China,Western Australian Tourism Commission,"$ 110,000.00 "
TWA2606,International Employer of Record Services – Southeast Asia,Western Australian Tourism Commission,"$ 140,000.00 "
DHW0510525,WA Police Force - Wyndham Police Station - Security System Upgrade,Department of Housing and Works,"$ 34,600.00 "
DHW0477925,Provision of Routine Maintenance for HVAC Mechanical Services - Department of Justice - West Kimberley Regional Prison,Department of Housing and Works,"$ 153,178.00 "
DHW0415125,Department of Housing and Works - Provision of Routine Maintenance for Sewerage and Waste Systems - Liquid Waste - Various Sites and Agencies - Southern Region,Department of Housing and Works,"$ 1,862,339.00 "
DHW0372025,Department of Education - Karrinyup Primary School - Major Upgrade - Cost Management Services,Department of Housing and Works,"$ 217,800.00 "
DEMIRS24989,Provision of PC Build Officers and Desktop Technology Provisioning Officers Services,"Department of Local Government, Industry Regulation and Safety","$ 1,349,849.00 "
DPLH407425,Engagement of a Principal Implementation Advisor for SAP under CUATPS2024,"Department of Planning, Lands and Heritage","$ 155,308.00 "
DPIRD2025268,Disposal of one (1) Toyota Forklift,Department of Primary Industries and Regional Development,$ 860.00 
LAWA20250813,Veeam Backup Software Licenses,Legal Aid Commission of WA,"$ 208,594.00 "
LW25195,Provision of Netbackup Expansion Shelves,Lotterywest,"$ 325,434.00 "
MRWA011524,Construction of Chester Pass Road and Menang Drive Flyover (Great Southern Region),Main Roads Western Australia,"$ 39,519,759.00 "
PWST202515555,Non-Compliance Contract to enable to purchase Server Infrastructure and Backup Infrastructure.,PathWest Laboratory Medicine WA,"$ 270,000.00 "
PROMSA25172,Pool Changeroom Upgrades Kent Street Senior High School,Programmed Facility Management,"$ 195,532.00 "
PROMSA25168,Roof Access & Fall Restraint Program,Programmed Facility Management,"$ 387,000.00 "
PTA250014,Provision of the Port Hedland Regional Town Bus Service,Public Transport Authority,"$ 21,927,349.00 "
DBCARIAT0326,Hybrid Electricity Generating System - Engineering Services Consultant,Rottnest Island Authority,"$ 1,786,255.00 "
DBCARIAQ2426,Rottnest Island Electrical Distribution Network Upgrade Phase 2 - Design and associated Engineering Services,Rottnest Island Authority,"$ 297,389.00 "
WACHS202515165,Provision of Maintenance of the Solar Power System Onslow Health Service,WA Country Health Service,"$ 184,676.00 "
WACHS202514961,"Replacement of and ongoing Maintenance Services to the Duress System at Community Mental Health, Bunbury Hospital",WA Country Health Service,"$ 152,457.00 "
CoP2024003,Provision of Oral Fluid Drug Screening Test Kits,Western Australia Police Force,"$ 13,230,000.00 "
20251291WAM,Board Management Solution,Western Australian Museum,"$ 164,543.00 "
CAHS202514679Rev1,Provision of SureSmile® Products and Services,Child and Adolescent Health Service,"$ 123,305.00 "
DBCA409WT0812025,"DBCA East Kimberley, Kununurra Office Extension","Department of Biodiversity, Conservation and Attractions","$ 1,941,332.00 "
CITS2516,Civics and Citizenship Recognition and Community Education Program 2026 - 2031,"Department of Creative Industries, Tourism and Sport","$ 584,192.00 "
ED252407,Year 10 Sport Elite Program Melbourne Tour for Aveley Secondary College,Department of Education,"$ 85,840.00 "
ED251496,Interactive Projectors for Canning Vale College,Department of Education,"$ 197,686.00 "
DEED2526020,State Advertising Campaign - Creative,Department of Energy and Economic Diversification,"$ 249,999.00 "
DHW0742902422,Western Australia Police Force - Warmun MFPF 7447 - Replacement of toilets to both cells,Department of Housing and Works,"$ 27,274.00 "
DHW0388025,Department of Education - Hampton Senior High School -  Removal of 3 x GLA from Shenton College and Installation of 3 x GLA Transportable Unit,Department of Housing and Works,"$ 509,950.00 "
DHW0381225,Department of Education - Bentley Primary School - Installation of 1 GLA and 1 KPP,Department of Housing and Works,"$ 275,666.00 "
DHW0149525,Department of Education - Norseman District High School - Bitumen Playcourt Upgrade Works,Department of Housing and Works,"$ 129,591.00 "
LGIRS25434,Geoscience Data Specialist,"Department of Mines, Petroleum and Exploration","$ 200,000.00 "
LGIRS25405,"Supply, Delivery with Post Warranty Service and Maintenance of Vertical Storage System","Department of Mines, Petroleum and Exploration","$ 291,000.00 "
DPIRD2025241,Provision of Cleaning Services for the Department of Primary Industries and Regional Development Broome District Office,Department of Primary Industries and Regional Development,"$ 117,080.00 "
DTMI420725,Datacentre Co-Location Equinox Shenton Park,Department of Transport and Major Infrastructure,"$ 361,746.00 "
NRTAFE122025,NRTAFE122025 - Supply and Delivery of Two (2) types of Twelve (12) Welders for NR TAFE Karratha Campus,North Regional TAFE,"$ 282,579.00 "
PWST202514824,"J Block Level 1 Refit of Churn Space and Forensic Pathology, QEII",PathWest Laboratory Medicine WA,"$ 296,897.00 "
PROMSA25195,Fire Upgrades - Sevenoaks Senior College,Programmed Facility Management,"$ 531,945.00 "
PROMSA25180,CCTV Cameras Installation Gilmour College,Programmed Facility Management,"$ 232,352.00 "
PROMSA25176,Door widening for disability access - Glencoe Primary School,Programmed Facility Management,"$ 123,096.00 "
PROMSA25162,Alterations & Additions - Falcon VFRS,Programmed Facility Management,"$ 1,307,091.00 "
PSC1052CM,Online Survey Platform,Public Sector Commission,"$ 1,385,439.00 "
PTA250074,Australind Railcar Vacuum Waste Extraction System - Picton Yard,Public Transport Authority,"$ 401,469.00 "
PTA250031,Service Desk and 2nd Level Support of Digital Line Systems and Microwave Radio Systems,Public Transport Authority,"$ 476,230.00 "
DBCA752GT1122025,Heavy Duty Tip Trucks,"Department of Biodiversity, Conservation and Attractions","$ 1,956,004.00 "
ED252549,Electricity - Honeywood Primary School (CUAELC2012),Department of Education,"$ 95,517.00 "
ED252531,France & UK Dance Tour for John Curtin College of the Arts,Department of Education,"$ 212,475.00 "
ED252497,2026 Hockey Tour (Flights) for Shenton College,Department of Education,"$ 88,216.00 "
DEED2526030,International Remuneration Framework,Department of Energy and Economic Diversification,"$ 81,840.00 "
DFES248325,Business Analyst for Workforce Management Services,Department of Fire and Emergency Services,"$ 111,540.00 "
DoH202514759,Provision of WA Sexual Health and Blood-Borne Virus Applied Research and Evaluation Network (SiREN) Project Management and Support Services,Department of Health (Royal Street),"$ 1,225,755.00 "
DHW0441125,Main Roads Western Australia - 36 Bayman Street Port Hedland - Demolition Works,Department of Housing and Works,"$ 197,857.00 "
LGIRS25480,Management Consulting Services,"Department of Local Government, Industry Regulation and Safety","$ 185,625.00 "
DPLH407325,Engagement of Change Management Support Officer under CUATPS2024,"Department of Planning, Lands and Heritage","$ 66,217.00 "
DPIRD2025278,"HVAC Interim Plan, Hillarys. Installation of Portable A/Cs",Department of Primary Industries and Regional Development,"$ 171,919.00 "
PO1000371,Floor carpet refresh,"Department of the Registrar, WA Industrial Relations Commission","$ 109,971.00 "
TWDTR05062024,Learning Management System,Department of Training and Workforce Development (DTWD),"$ 8,502,000.00 "
DTMI421025,Privileged Access Management Implementation,Department of Transport and Major Infrastructure,"$ 253,000.00 "
EMHS202515573,Equipment and Asset Condition Assessment Audit,East Metropolitan Health Service,"$ 77,657.00 "
JN2351562,LG01382023 CUMV Shire of Broome,Landgate,"$ 2,750.00 "
LW25194,Technical Assurance Services - Gaming System Replacement Project,Lotterywest,"$ 725,200.00 "
PROMSA25121,Woodlands Primary - Electrical Upgrade Roofing Program,Programmed Facility Management,"$ 213,126.00 "
PTA250067,Maintenance Agreement for PTA Railcar Video Surveillance System Equipment and Software,Public Transport Authority,"$ 517,862.00 "
PTA250020,Provision of the Collie Regional Town Bus Services,Public Transport Authority,"$ 2,031,565.00 "
M25002C,HBF Park Lounge and Gareth Naven HvAC Upgrade,VenuesWest,"$ 144,859.00 "
WAPOL00525,SUPPORT & MAINTENANCE OF POLICE ASSISTANCE CENTRE WORKFORCE MANAGEMENT PLATFORM,Western Australia Police Force,"$ 307,954.00 "
ED252342,Year 7 - 10 HASS Textbooks for Rockingham Senior High School,Department of Education,"$ 54,701.00 "
DFES247925,Executive Master of Public Administration Program,Department of Fire and Emergency Services,"$ 68,743.00 "
DHW0387225,Department of Education - Baldivis Primary School - Installation of 1x GLA Modular Classroom with Associated Deck and Ramp,Department of Housing and Works,"$ 138,038.00 "
DHW0338525A,Department of Health - Metropolitan Youth (Stirling) - Step Up Step Down (SUSD) Facility - Cost Management Services,Department of Housing and Works,"$ 201,909.00 "
DHW0338525,Department of Health - Metropolitan Youth Step Up Step Down Facility - Architectural Services,Department of Housing and Works,"$ 682,383.00 "
DPLHPE013809,Provision of Executive Leadership Coaching,"Department of Planning, Lands and Heritage","$ 56,609.00 "
TWDT05092024,Provision of Homestay and Airport Pickup Services for International Students studying within the Western Australian TAFE Colleges and Western Australian Government Schools,Department of Training and Workforce Development (DTWD),"$ 7,092,581.00 "
TWDE05682025,Subscription to uWorkin Talent Community Platform (Job Matching Software Application),Department of Training and Workforce Development (DTWD),"$ 373,945.00 "
DOT419625,"Design, Development and Ongoing Support for OMID Website",Department of Transport and Major Infrastructure,"$ 468,763.00 "
DOT416025,Provision of ICT Research and Advisory Services,Department of Transport and Major Infrastructure,"$ 1,299,368.00 "
CUARWD2025,Recycling and Waste Redirection Services Common Use Arrangement (CUA),Department of Treasury and Finance,"$ 195,000,000.00 "
LW24007,Lottery Gaming Solution and Digital Solution,Lotterywest,"$ 332,700,000.00 "
MRWA0197180144,Construction of South Western Highway H009 Seal Shoulders on Existing Formation SLK 408.61 – 431.13 - Great Southern Region,Main Roads Western Australia,"$ 3,684,829.00 "
MW24119Fibre,Fibre Upgrade for Fire Panels – QEII,North Metropolitan Health Service,"$ 62,014.00 "
NMTAFEP2025033,Provision of Cloud-Based Backup and Disaster Recovery Services for North Metropolitan TAFE,North Metropolitan TAFE,"$ 107,170.00 "
PWST202515034,Provision of Electrical Supply Upgrade for Osborne Park Hospital D Block Laboratory Replacement,PathWest Laboratory Medicine WA,"$ 267,801.00 "
PWST202411687,Transport and Storage of Deceased Persons,PathWest Laboratory Medicine WA,"$ 4,520,000.00 "
PROMSA25124,Early Childhood Playground Upgrade - Meadow Springs South Primary School,Programmed Facility Management,"$ 334,011.00 "
WAPOL07025,CCTV Headend and Camera Replacement - Fremantle Detectives,Western Australia Police Force,"$ 43,602.00 "
DBCA409WQ1232025,Installation and Service Connection to DBCA Depot Accommodation Units.,"Department of Biodiversity, Conservation and Attractions","$ 247,493.00 "
DBCA409WQ1092025,Molly Springs Day Use Track Upgrade,"Department of Biodiversity, Conservation and Attractions","$ 179,000.00 "
DOC202463991,WA Behaviour Support Practioner Services,Department of Communities,"$ 3,200,000.00 "
ED252431,2026 Shenton College Europe Hockey Tour,Department of Education,"$ 162,178.00 "
ED252110,Electricity - Moorditj Noongar Community College (CUAELC2012),Department of Education,"$ 72,165.00 "
ED250328,Consultancy and Coaching Services to facilitate a design thinking process for the Department of Education,Department of Education,"$ 198,990.00 "
ED250148,Supply and Delivery of One (1) New Bus for Rockingham Senior High School Education Support Centre,Department of Education,"$ 203,077.00 "
DoH202615360,ASHM Health Workforce Development,Department of Health (Royal Street),"$ 265,452.00 "
DHW0596824,Department of Education - Koorana Primary School - Education Support Centre - Occupational Safety and Health Consultant Panel,Department of Housing and Works,"$ 5,020.00 "
DHW0529223,Department of Education - Wanneroo Secondary College - Education Support Center - Occupational Safety and Health Consultancy Services Panel,Department of Housing and Works,"$ 3,331.00 "
DHW0508925,Department of Justice - Broome Regional Prison - Multi Purpose Cell2 A - C Replacement,Department of Housing and Works,"$ 33,000.00 "
DHW0384925,Department of Education - Caladenia Primary School - Relocation of 1 x GLA Transportable Classroom including associated works,Department of Housing and Works,"$ 161,525.00 "
DHW0384825,Department of Education - Burns Beach Primary School - Refurbishment and Installation of 2 x GLA Transportable Classrooms including associated works,Department of Housing and Works,"$ 356,490.00 "
DOT419325,DTMI Sustainability Strategy Materiality and Objectives Stakeholder Workshops,Department of Transport and Major Infrastructure,"$ 52,602.00 "
DOT416625,Initiation Services - Western Power,Department of Transport and Major Infrastructure,"$ 695,750.00 "
DOT415825,"Oracle Software Licenses, Support and Maintenance",Department of Transport and Major Infrastructure,"$ 4,895,507.00 "
DWER106224,Vasse-Busselton Flood Modelling and Drainage Study,Department of Water and Environmental Regulation,"$ 304,122.00 "
DWER100425,WA Climate Projection Viewer,Department of Water and Environmental Regulation,"$ 1,077,065.00 "
NMHS202515510,St Patrick’s Community Support Centre – Federation Funding Agreement 2025-2026,North Metropolitan Health Service,"$ 143,550.00 "
NRTAFE142025,Licence to Operate the Cafeteria at NR TAFE Karratha Campus,North Regional TAFE,$ 1.00 
PWST202515386,Supply and Installation of Oracle Hardware,PathWest Laboratory Medicine WA,"$ 632,975.00 "
PROPTA25036,"Beenyup Bus Depot - Storage Yard Hardstand, Comms and Electrical",Programmed Facility Management,"$ 173,888.00 "
PROMSA25131,Rosalie Primary School - Outdoor Upgrade – Shade Structure,Programmed Facility Management,"$ 215,440.00 "
SMHS202515467,Fremantle Hospital Day Admissions Centre (DAC) Lighting Replacement,South Metropolitan Health Service,"$ 80,224.00 "
SMHS202515446,Fremantle Hospital - B-block air handling unit (AHU) refresh and associated works,South Metropolitan Health Service,"$ 179,650.00 "
SMT2025259,SMT2025259 Veeam Software Maintenance Renewal 2026,South Metropolitan TAFE,"$ 216,543.00 "
WACHS202615425,Reticulated gas supply under Common Use Arrangement CUA RGS 2014 for Busselton Health Campus and Harvey Hospital,WA Country Health Service,"$ 324,988.00 "
DOC202548295,Provision of digitisation of paper and electronic records services,Department of Communities,"$ 111,272.00 "
FINW0553124,Department of Fire and Emergency Services - Boyup Brook VFRS - Appliance Bay Replacement and Associated Minor Works,Department of Housing and Works,"$ 943,998.00 "
DHW0622824,Department of Education - Cowaramup Primary School - Installation of 1x GLA Modular Classroom and 1x KPP Modular Classroom,Department of Housing and Works,"$ 500,485.00 "
DHW0432225,Department of Education - Rostrata Primary School - New Primary School Block - SIP - EC25 - Time Planning Services,Department of Housing and Works,"$ 37,520.00 "
DHW0387625,Department of Education - Woodland Grove Primary School - Installation of 1 X GLA classroom and 1 X KPP classroom,Department of Housing and Works,"$ 361,118.00 "
DHW0286325,"Department of Creative Industries, Tourism and Sport - WA Maritime Museum Partial ACP Replacement",Department of Housing and Works,"$ 1,548,695.00 "
DPIRD2025181,Supply Delivery Installation and Training of one (1) VS200 Microscope Slide Scanner,Department of Primary Industries and Regional Development,"$ 242,307.00 "
24093497002A,Armadale Health Service (AHS) Pedestrian Footpath Upgrade - Stage 1,East Metropolitan Health Service,"$ 175,840.00 "
HSS202515549,WA Health Data Platform (WAHDP) Program - Provision of Project Manager,Health Support Services,"$ 95,710.00 "
HSS202515517,"Provision of the SCGH ICU Pod West Project BoM - G Block, Level 4, Rooms 4.3.4 and 4.3.25",Health Support Services,"$ 159,198.00 "
HSS202515515,"Provision of the SCGH ED Refurbishment G Block, Ground Floor - Room G.19.2",Health Support Services,"$ 92,706.00 "
HSS202515514,"Provision of the SCGH ED refurbishment for G Block, Ground Floor – Room G.18.3",Health Support Services,"$ 92,706.00 "
MRWA016325,Provision of INX Software Licensing Agreement Renewal,Main Roads Western Australia,"$ 102,712.00 "
PROPTA25046,Multiple Escalator Waterproofing Works - Elizabeth Quay Bus Station,Programmed Facility Management,"$ 198,844.00 "
PROMSA25189,Plasterglass Ceiling Program - Kalamunda SHS,Programmed Facility Management,"$ 108,796.00 "
PTA251127,Capital Budget Officer,Public Transport Authority,"$ 88,000.00 "
SRT2025027,"Supply and Delivery of one (1) x Trailer Mounted Boom Lift for South Regional TAFE, Collie Workshop",South Regional TAFE,"$ 79,321.00 "
WAEC25005,Project Officer,Western Australian Electoral Commission,"$ 62,700.00 "
CAHS202514858,Burns & Oncology Garden Upgrade - Level 1 Rooftop Garden Demolition and Construction - Perth Children’s Hospital,Child and Adolescent Health Service,"$ 4,689,246.00 "
ED240368,ICT Research and Advisory Services,Department of Education,"$ 1,700,000.00 "
DHW0406525,Department of Education - Padbury Primary School - Installation of 1 GLA,Department of Housing and Works,"$ 152,905.00 "
DHW0384225,Department of Education - Riva Primary School - Installation of 2 x GLA Transportable Unit,Department of Housing and Works,"$ 299,045.00 "
DHW0333025A,Department of Education  - Warburton Remote Community School - Internal and External Painting,Department of Housing and Works,"$ 198,000.00 "
DPIRD2025087,Project Leader Tester Services,Department of Primary Industries and Regional Development,"$ 140,863.00 "
EOITWDV05522025,Western Australian Defence Industry Reskilling and Upskilling Grant Program - Round Two,Department of Training and Workforce Development (DTWD),"$ 685,000.00 "
MRWA013825,Renewal of SAS Software 2025,Main Roads Western Australia,"$ 66,998.00 "
PROPTA25040,Kalamunda Hardstand,Programmed Facility Management,"$ 558,826.00 "
PROPTA25039,"Workshop Bathroom, Locker, Lunchroom & Office Upgrade - Welshpool Bus Depot",Programmed Facility Management,"$ 71,369.00 "
PROMSA25182,Gas Heaters & Air Conditioning Works - East Wanneroo Primary School,Programmed Facility Management,"$ 129,651.00 "
PROMSA25155,Perimeter Fencing Works - Yuluma Primary School,Programmed Facility Management,"$ 197,877.00 "
PTA250076,PTA250076 Perth Stadium Station Facility Works - Construction,Public Transport Authority,"$ 236,617.00 "
PTA250039,Provision of a Web-based Stakeholder and Database Management Platform,Public Transport Authority,"$ 419,425.00 "
DBCARIAQ2324,Provision of Multipurpose Uniform,Rottnest Island Authority,"$ 307,275.00 "
SMT2025260,SMT2025260 Cisco Hardware Maintenance Renewal 2026,South Metropolitan TAFE,"$ 426,184.00 "
WAPOL04025,Herne Hill – Supply and Install 5 Horse Shelters,Western Australia Police Force,"$ 97,939.00 "
WAEC25003RFQ,Process Mapping Services,Western Australian Electoral Commission,"$ 132,000.00 "
2025649WAM,Panasonic Projectors,Western Australian Museum,"$ 454,464.00 "
CITSC2549,Network Administration Services 2025-2028,"Department of Creative Industries, Tourism and Sport","$ 1,097,297.00 "
ED252476,Electricity - Warriapendi Primary School (CUAELC2012),Department of Education,"$ 77,363.00 "
DFES231224,Provision of Personal Protective Equipment (PPE) and Consumables,Department of Fire and Emergency Services,"$ 1,250,000.00 "
DHW0616322A2,Western Australian Police Force - Warwick Police Station - Fit-Out,Department of Housing and Works,"$ 89,901.00 "
DHW0387425,Department of Education - Peel LDC  (Mandurah Primary School) - Installation of 1 x modular KPP classroom,Department of Housing and Works,"$ 286,865.00 "
DHW0100425G,Department of Education - 2025 Late year program - Construction of 5 Kindy Pre-Primary (KPP) Transportable Building,Department of Housing and Works,"$ 1,816,587.00 "
DHW0100425F,Department of Education - 2025 Late year program - Construction of 10 Toilet Block (TB) Transportable Building,Department of Housing and Works,"$ 1,813,451.00 "
DHW0100425E,Department of Education - 2025 Late year program - Construction of 10 Accessible Ambulant Toilet (AAT) Transportable Building,Department of Housing and Works,"$ 1,655,482.00 "
